{
  "case_id": "case-001",
  "executive_summary": "面向客户约束的方案摘要；事实结论必须有证据。",
  "requirements": [
    {
      "name": "部署方式",
      "value": "私有化",
      "priority": "must",
      "source": "customer_brief"
    }
  ],
  "recommendation": [
    "先完成小规模 PoC，再根据实际并发测试决定部署形态。"
  ],
  "architecture": [
    "需求输入",
    "知识检索",
    "方案生成",
    "证据校验"
  ],
  "implementation_steps": [
    "整理资料",
    "建立评测集",
    "验证性能",
    "灰度交付"
  ],
  "poc_plan": [
    {
      "phase": "1-需求与数据准备",
      "objective": "确认可验收目标和数据边界",
      "activities": ["收集脱敏样本", "确认并发、时延和权限约束"],
      "deliverables": ["需求基线", "黄金问题集"],
      "exit_criteria": "关键字段有明确值或被标记为待确认。"
    }
  ],
  "model_strategy": {
    "primary_serving_path": "先用云端 API 建立质量基线，再在目标硬件复测本地路径。",
    "fallback_serving_path": "OpenAI-compatible API",
    "retrieval_strategy": "RAG-first，持续变化的产品事实保留在知识库。",
    "fine_tuning_strategy": "基线稳定后，仅用 LoRA/QLoRA 优化稳定格式和工具参数。",
    "quantization_strategy": "比较质量、TTFT、p95、吞吐和内存，不按文件大小单独决策。",
    "serving_reason": "需要在真实数据和目标硬件上复测。",
    "decision_inputs": {"peak_concurrency": "待确认", "deployment": "私有化"},
    "validation_before_commitment": ["使用黄金集和对抗集回归", "在目标硬件压测"]
  },
  "assumptions": [
    "示例使用合成客户资料和版本化知识库。",
    "容量、SLA、价格和合规结论必须经过客户侧复核。"
  ],
  "risks": [
    {
      "category": "容量",
      "description": "需要在目标硬件和峰值并发下实测。",
      "severity": "medium",
      "action": "补充压测数据"
    }
  ],
  "clarifying_questions": [
    "峰值并发和完整答案延迟目标是多少？"
  ],
  "evidence": [
    {
      "evidence_id": "KB-001",
      "title": "AI 产品能力矩阵",
      "excerpt": "证据原文片段",
      "source_path": "data/knowledge/product-capability.md",
      "relevance": 0.9
    }
  ],
  "review_status": "not_required",
  "model_name": "dify",
  "latency_ms": 0,
  "usage": {}
}
